{
  "name": "Tagoar",
  "rarity": "Epic",
  "affinity": "Magic",
  "faction": "Orcs",
  "role": "Support",
  "draft": true,
  "meta_ratings": {
    "clan_boss": "X/10",
    "dungeons": "X/10",
    "doom_tower": "X/10",
    "arena": "X/10",
    "faction_wars": "X/10"
  },
  "forms": [
    {
      "form_name": "Base",
      "base_stats": {
        "HP": 18165,
        "ATK": 1145,
        "DEF": 947,
        "SPD": 105,
        "C.RATE": 18,
        "C.DMG": 50,
        "RES": 18,
        "ACC": ""
      },
      "skills": [
        {
          "name": "Da Magic Stick",
          "type": "A1",
          "description": "Attacks 1 enemy 2 times. Places a 60% [Increase DEF] buff for 2 turns on the ally with the lowest current HP.\nLevel 2: Damage +5%\nLevel 3: Damage +5%\nLevel 4: Damage +5%\nLevel 5: Damage +5%\nDamage Multiplier: 1.8 ATK",
          "effects": [
            {
              "type": "damage|shield|heal|turn_meter_fill|turn_meter_steal|revive|buff|debuff|stat_swap|stat_steal|reflect_damage|other",
              "stat": "ATK|HP|DEF|MAX HP|ENEMY_MAX_HP|Turn Meter|NA|... (as needed, where NA is 'not applicable'. This allows schema validation. This value should not be null)",
              "value": 0.0,
              "per_hit": false,
              "target": "single_enemy|random_enemy|aoe_enemies|single_ally|random_ally|aoe_allies|self",
              "duration": "Duration of buff/debuff in turns (if applicable)",
              "notes": "Describe scaling, conditions, or special logic. Use multiple objects for multi-component or conditional effects."
            }
          ],
          "cooldown_booked": null,
          "mechanics_tags": [
            "Relevant mechanic tags"
          ],
          "book_value": "Value to fully book ex faster cooldown, more damage or debuff chance, etc.",
          "notes": "Additional notes (conditional effects, scaling, special interactions, etc.)"
        },
        {
          "name": "Charge Cant (Cooldown: 5 turns)",
          "type": "A2",
          "description": "Attacks all enemies. Places a 30% [Increase SPD] buff on all allies for 2 turns, then heals all allies by 15% of this Champion’s MAX HP.\nLevel 2: Heal +10%\nLevel 3: Heal +10%\nLevel 4: Cooldown -1\nLevel 5: Cooldown -1\nDamage Multiplier: 3.7 ATK",
          "effects": [
            {
              "type": "damage|shield|heal|turn_meter_fill|turn_meter_steal|revive|buff|debuff|stat_swap|stat_steal|reflect_damage|other",
              "stat": "ATK|HP|DEF|MAX HP|ENEMY_MAX_HP|Turn Meter|NA|... (as needed, where NA is 'not applicable'. This allows schema validation. This value should not be null)",
              "value": 0.0,
              "per_hit": false,
              "target": "single_enemy|random_enemy|aoe_enemies|single_ally|random_ally|aoe_allies|self",
              "duration": "Duration of buff/debuff in turns (if applicable)",
              "notes": "Describe scaling, conditions, or special logic. Use multiple objects for multi-component or conditional effects."
            }
          ],
          "cooldown_booked": null,
          "mechanics_tags": [
            "Relevant mechanic tags"
          ],
          "book_value": "Value to fully book ex faster cooldown, more damage or debuff chance, etc.",
          "notes": "Additional notes (conditional effects, scaling, special interactions, etc.)"
        },
        {
          "name": "Rise and Fight (Cooldown: 7 turns)",
          "type": "A3",
          "description": "Revives all dead allies with 30% HP. Also places a [Shield] buff on all allies for 2 turns equal to 20% of this Champion’s MAX HP.\nLevel 2: Cooldown -1\nLevel 3: Cooldown -1",
          "effects": [
            {
              "type": "damage|shield|heal|turn_meter_fill|turn_meter_steal|revive|buff|debuff|stat_swap|stat_steal|reflect_damage|other",
              "stat": "ATK|HP|DEF|MAX HP|ENEMY_MAX_HP|Turn Meter|NA|... (as needed, where NA is 'not applicable'. This allows schema validation. This value should not be null)",
              "value": 0.0,
              "per_hit": false,
              "target": "single_enemy|random_enemy|aoe_enemies|single_ally|random_ally|aoe_allies|self",
              "duration": "Duration of buff/debuff in turns (if applicable)",
              "notes": "Describe scaling, conditions, or special logic. Use multiple objects for multi-component or conditional effects."
            }
          ],
          "cooldown_booked": null,
          "mechanics_tags": [
            "Relevant mechanic tags"
          ],
          "book_value": "Value to fully book ex faster cooldown, more damage or debuff chance, etc.",
          "notes": "Additional notes (conditional effects, scaling, special interactions, etc.)"
        },
        {
          "name": "Aid the Feeble (Passive)",
          "type": "Passive",
          "description": "Decreases the damage received by allies with 50% HP or less by 10%.",
          "effects": [
            {
              "type": "damage|shield|heal|turn_meter_fill|turn_meter_steal|revive|buff|debuff|stat_swap|stat_steal|reflect_damage|other",
              "stat": "ATK|HP|DEF|MAX HP|ENEMY_MAX_HP|Turn Meter|NA|... (as needed, where NA is 'not applicable'. This allows schema validation. This value should not be null)",
              "value": 0.0,
              "per_hit": false,
              "target": "single_enemy|random_enemy|aoe_enemies|single_ally|random_ally|aoe_allies|self",
              "duration": "Duration of buff/debuff in turns (if applicable)",
              "notes": "Describe scaling, conditions, or special logic. Use multiple objects for multi-component or conditional effects."
            }
          ],
          "cooldown_booked": null,
          "mechanics_tags": [
            "Relevant mechanic tags"
          ],
          "book_value": "Value to fully book ex faster cooldown, more damage or debuff chance, etc.",
          "notes": "Additional notes (conditional effects, scaling, special interactions, etc.)"
        },
        {
          "name": "",
          "type": "A5",
          "description": "",
          "effects": [
            {
              "type": "damage|shield|heal|turn_meter_fill|turn_meter_steal|revive|buff|debuff|stat_swap|stat_steal|reflect_damage|other",
              "stat": "ATK|HP|DEF|MAX HP|ENEMY_MAX_HP|Turn Meter|NA|... (as needed, where NA is 'not applicable'. This allows schema validation. This value should not be null)",
              "value": 0.0,
              "per_hit": false,
              "target": "single_enemy|random_enemy|aoe_enemies|single_ally|random_ally|aoe_allies|self",
              "duration": "Duration of buff/debuff in turns (if applicable)",
              "notes": "Describe scaling, conditions, or special logic. Use multiple objects for multi-component or conditional effects."
            }
          ],
          "cooldown_booked": null,
          "mechanics_tags": [
            "Relevant mechanic tags"
          ],
          "book_value": "Value to fully book ex faster cooldown, more damage or debuff chance, etc.",
          "notes": "Additional notes (conditional effects, scaling, special interactions, etc.)"
        }
      ],
      "aura": "Increases Ally HP in all battles by 25%",
      "comments": "Form-specific notes, edge cases, or user/community feedback."
    }
  ],
  "mechanics_tags": [
    "Relevant mechanic tags"
  ],
  "stat_priorities": [
    "Stat priorities for main content(s)",
    "e.g. 100% Crit Rate, 250+ ACC"
  ],
  "stat_priority_recommendations": {
    "clan_boss": "e.g. 250+ ACC, 220+ SPD, 100% C.RATE",
    "dungeons": "e.g. 220+ SPD, 200+ ACC, HP%/DEF% for survivability",
    "arena": "e.g. 300+ SPD, 100% C.RATE, C.DMG, RES for tank"
  },
  "recommended_gear": [
    "Recommended sets and stats for main content(s)"
  ],
  "masteries": {
    "clan_boss": [
      "Recommended masteries for Clan Boss"
    ],
    "dungeons": [
      "Recommended masteries for Dungeons"
    ],
    "arena": [
      "Recommended masteries for Arena"
    ],
    "doom_tower": [
      "Recommended masteries for Doom Tower"
    ],
    "faction_wars": [
      "Recommended masteries for Faction Wars"
    ],
    "general": [
      "Offense/Support/Defense as needed"
    ]
  },
  "blessings": [
    "Recommended blessings for priority content(s)"
  ],
  "ai_quirks": {
    "bad_ai": false,
    "ai_issue_description": "Describe problematic skill priority, targeting, or auto-play behavior"
  },
  "cheese_strategy": {
    "cheese_viable": false,
    "cheese_type": "unkillable/max HP/passive sustain/etc.",
    "cheese_mechanic_info": "If true, describe the cheese mechanic and requirements"
  },
  "mechanics_advisory": "Notes on unique mechanics, synergy, or special use cases",
  "validation_metadata": {
    "stat_confidence": 87.5,
    "data_sources": "ayumilove_ocr+hellhades",
    "source_priority": {
      "stats": "ayumilove_ocr",
      "skills": "ayumilove",
      "info": "ayumilove"
    },
    "ocr_notes": "Ayumilove OCR: Primary stats source (7/8 extracted), Ayumilove: Skills source (canonical), HellHades: Info validation"
  },
  "citations": [
    "Ayumilove: https://ayumilove.net/raid-shadow-legends-champion-name/ (accessed YYYY-MM-DD)",
    "HellHades: https://hellhades.com/champions/champion-name/ (accessed YYYY-MM-DD)"
  ],
  "author": "Author Name (e.g., GitHub Copilot)",
  "comments": "Top-level comments about the entry. For form-specific notes use forms[*].comments.",
  "update_notes": {
    "last_updated": "YYYY-MM-DD",
    "last_patch": "Patch version/date and summary of change"
  }
}