{
  "name": "Apothecary",
  "rarity": "Legendary",
  "affinity": "Force",
  "faction": "High Elves",
  "role": "Attack",
  "draft": true,
  "forms": [
    {
      "form_name": "Base",
      "base_stats": {
        "HP": 17175,
        "ATK": 881,
        "DEF": 1002,
        "SPD": 106,
        "C.RATE": 15,
        "C.DMG": 50,
        "RES": 30,
        "ACC": 0
      },
      "skills": [
        {
          "name": "Scatterbolt",
          "description": "Attacks 3 times at random.\nDamage based on\n[ATK]\nLevel 2: Damage +5%\nLevel 3: Damage +5%\nLevel 4: Damage +5%\nLevel 5: Damage +10%",
          "type": "Active",
          "effects": [],
          "cooldown_booked": null
        },
        {
          "name": "Soothing Chant",
          "description": "Heals a target ally by 35% HP. This Heal can be critical.\nLevel 2: Heal +5%\nLevel 3: Heal +5%\nLevel 4: Heal +5%\nLevel 5: Cooldown -1",
          "type": "Active",
          "effects": [],
          "cooldown_booked": null
        },
        {
          "name": "Boon of Speed",
          "description": "Places a 30%\n[Increase Speed]\nbuff on all allies for 2 turns. Fills the Turn Meter of all allies by 15%.\nLevel 2: Cooldown -1\nLevel 3: Cooldown -1",
          "type": "Active",
          "effects": [],
          "cooldown_booked": null
        },
        {
          "name": "Aura",
          "description": "Increases Ally DEF in Dungeons by 21%",
          "type": "Aura",
          "effects": null,
          "cooldown_booked": null
        }
      ],
      "aura": null,
      "comments": "Imported from RaidWiki."
    }
  ]
}