{
  "name": "Michelangelo",
  "rarity": "Legendary",
  "affinity": "Spirit",
  "faction": "Banner Lords",
  "role": "Attack / Debuffer / Hybrid Control",
  "meta_ratings": {
    "clan_boss": "7/10",
    "dungeons": "9/10",
    "doom_tower": "9/10",
    "arena": "9/10",
    "faction_wars": "9/10"
  },
  "forms": [
    {
      "form_name": "Base",
      "base_stats": {
        "HP": 15360,
        "ATK": 1520,
        "DEF": 1035,
        "SPD": 99,
        "C.RATE": 15,
        "C.DMG": 63,
        "RES": 30,
        "ACC": 10
      },
      "skills": [
        {
          "name": "Boo-Yah!",
          "type": "A1",
          "description": "Attacks 1 enemy 2 times. If either hit was critical, places a 50% Increase ATK buff on this Champion for 2 turns.",
          "effects": [
            {
              "type": "damage",
              "stat": "ATK",
              "value": 2.0,
              "per_hit": true,
              "target": "single_enemy",
              "notes": "Double hit. Places Increase ATK on crit."
            }
          ],
          "cooldown_booked": null,
          "mechanics_tags": ["Double Hit", "Increase ATK"],
          "book_value": "+20% Damage",
          "notes": "Self-buffing for increased damage output."
        },
        {
          "name": "Express Delivery!",
          "type": "A2",
          "description": "Attacks 1 enemy. Before attacking, has a 75% chance of placing a 60% Decrease DEF debuff for 2 turns and a 75% chance of placing a Stun debuff for 1 turn. Will ignore 25% of the target's RES if the attack is critical. Then applies a Debuff Spread effect, taking all debuffs from the target and placing them on all enemies. Will ignore 25% of each target's RES if the initial attack was critical.",
          "effects": [
            {
              "type": "damage",
              "stat": "ATK",
              "value": 6.0,
              "per_hit": false,
              "target": "single_enemy",
              "notes": "Single target. Decrease DEF, Stun, Debuff Spread, Ignore RES."
            }
          ],
          "cooldown_booked": 3,
          "mechanics_tags": ["Decrease DEF", "Stun", "Debuff Spread", "Ignore RES"],
          "book_value": "+25% Buff/Debuff Chance, Cooldown -1",
          "notes": "Debuff spread is powerful for AoE control."
        },
        {
          "name": "Shell Cyclone",
          "type": "A3",
          "description": "Attacks all enemies. Has a 75% chance of placing a 50% Decrease ATK debuff and a Leech debuff for 2 turns. Will ignore 25% of each target's RES if the attack is critical. Then places a Taunt buff on this Champion for 2 turns.",
          "effects": [
            {
              "type": "damage",
              "stat": "ATK",
              "value": 5.0,
              "per_hit": false,
              "target": "aoe_enemies",
              "notes": "AoE. Decrease ATK, Leech, Taunt, Ignore RES."
            }
          ],
          "cooldown_booked": 4,
          "mechanics_tags": ["AoE", "Decrease ATK", "Leech", "Taunt", "Ignore RES"],
          "book_value": "+25% Buff/Debuff Chance, Cooldown -1",
          "notes": "Self-taunt and leech for survivability and team sustain."
        },
        {
          "name": "Party Dude",
          "type": "Passive",
          "description": "[Passive Effect] Has a 15% chance to Evade an enemy skill and all of its effects. If this Champion is under a Taunt buff, the chance to Evade increases to 30%. Whenever Leonardo, Donatello, Michelangelo, or Raphael attacks, this Champion joins in that attack. [Active Effect] Places a Shield buff equal to 300% of this Champion's ATK on this Champion for 1 turn when they receive a hit.",
          "effects": null,
          "cooldown_booked": 1,
          "mechanics_tags": ["Evade", "Ally Join Attack", "Shield (self)", "Synergy: Turtles"],
          "book_value": "",
          "notes": "Unique synergy with other TMNT champions. Shield triggers on every hit."
        }
      ],
      "aura": "Increases Ally ACC in All Battles by 70.",
      "comments": "TMNT event champion. Excels at debuff spreading and hybrid control. Synergizes with other Turtles."
    }
  ],
  "mechanics_tags": ["Double Hit", "Increase ATK", "Decrease DEF", "Stun", "Debuff Spread", "Ignore RES", "AoE", "Decrease ATK", "Leech", "Taunt", "Evade", "Ally Join Attack", "Shield (self)", "Synergy: Turtles"],
  "stat_priorities": ["ATK%", "C.RATE", "C.DMG", "SPD", "ACC"],
  "stat_priority_recommendations": {
    "clan_boss": "ATK%, C.RATE, C.DMG, SPD, ACC",
    "dungeons": "ATK%, C.RATE, C.DMG, SPD, ACC",
    "arena": "ATK%, C.RATE, C.DMG, SPD, ACC"
  },
  "recommended_gear": ["Merciless", "Savage", "Lethal", "Cruel", "Perception", "Bloodthirst", "Impulse", "Lifesteal", "Reflex", "Relentless", "Zeal", "Accuracy", "Critical Damage", "Divine Speed", "Fatal", "Feral", "Instinct", "Killstroke", "Pinpoint", "Speed", "Supersonic"],
  "masteries": {
    "clan_boss": [
      "OFFENSE: Deadly Precision, Keen Strike, Heart of Glory, Single Out, GIANT SLAYER (CRITICAL - A1 'Dual Strike' attacks 2 times, 30% proc per hit = ~51% total proc chance). CORRECTED: Warmaster INCORRECT for multi-hit champion.",
      "DEFENSE: Tough Skin, Blastproof, Resurgent, Delay Death, Retribution",
      "SUPPORT: Pinpoint Accuracy, Charged Focus, SWARM SMITER (CRITICAL - multi-hit synergy with A1), Evil Eye, EAGLE EYE (CRITICAL - +50 ACC for 250+ total), Lore of Steel, MASTER HEXER (CRITICAL - extends Dec DEF/Weaken/HP Burn debuffs), CYCLE OF MAGIC (CRITICAL - reduces A2/A3 cooldowns for more frequent utility)"
    ],
    "dungeons": [
      "OFFENSE: Deadly Precision, Keen Strike, Heart of Glory, Single Out, GIANT SLAYER (CRITICAL - A1 'Dual Strike' attacks 2 times, 30% proc per hit = ~51% total proc chance). CORRECTED: Helmsmasher can work for Arena burst, but Giant Slayer optimal for dungeon bosses.",
      "DEFENSE: Tough Skin, Blastproof, Resurgent, Delay Death, Retribution",
      "SUPPORT: Pinpoint Accuracy, Charged Focus, SWARM SMITER (CRITICAL - multi-hit synergy with A1), Evil Eye, EAGLE EYE (CRITICAL - +50 ACC for 250+ total), Lore of Steel, MASTER HEXER (CRITICAL - extends Dec DEF/Weaken/HP Burn), CYCLE OF MAGIC (CRITICAL - faster A2/A3 cycling), Cycle of Violence (speed boost), Methodical (cooldown reduction)"
    ],
    "arena": [
      "OFFENSE: Deadly Precision, Keen Strike, Heart of Glory, Single Out, HELMSMASHER (Ignore DEF for burst damage in Arena) OR Giant Slayer if using multi-hit A1 setup",
      "DEFENSE: Tough Skin, Blastproof, Resurgent, Delay Death, Retribution",
      "SUPPORT: Pinpoint Accuracy, Charged Focus, SWARM SMITER (multi-hit synergy), Evil Eye, EAGLE EYE (CRITICAL - +50 ACC for debuffs), Lore of Steel, MASTER HEXER (extends Dec DEF/Weaken), Whirlwind of Death (AoE damage boost), Cycle of Violence, Kill Streak, Methodical"
    ],
    "doom_tower": [
      "OFFENSE: Deadly Precision, Keen Strike, Heart of Glory, Single Out, GIANT SLAYER (CRITICAL - A1 'Dual Strike' attacks 2 times, 30% proc per hit = ~51% total proc chance). CORRECTED: Helmsmasher can work, but Giant Slayer optimal for boss floors.",
      "DEFENSE: Tough Skin, Blastproof, Resurgent, Delay Death, Retribution",
      "SUPPORT: Pinpoint Accuracy, Charged Focus, SWARM SMITER (CRITICAL - multi-hit synergy with A1), Evil Eye, EAGLE EYE (CRITICAL - +50 ACC for 250+ total), Lore of Steel, MASTER HEXER (CRITICAL - extends Dec DEF/Weaken/HP Burn), CYCLE OF MAGIC (CRITICAL - faster A2/A3 cycling), Cycle of Violence"
    ],
    "faction_wars": [
      "OFFENSE: Deadly Precision, Keen Strike, Heart of Glory, Single Out, GIANT SLAYER (CRITICAL - A1 'Dual Strike' attacks 2 times, 30% proc per hit = ~51% total proc chance). CORRECTED: Helmsmasher can work, but Giant Slayer optimal for boss floors.",
      "DEFENSE: Tough Skin, Blastproof, Resurgent, Delay Death, Retribution",
      "SUPPORT: Pinpoint Accuracy, Charged Focus, SWARM SMITER (CRITICAL - multi-hit synergy with A1), Evil Eye, EAGLE EYE (CRITICAL - +50 ACC for 250+ total), Lore of Steel, MASTER HEXER (CRITICAL - extends Dec DEF/Weaken/HP Burn), CYCLE OF MAGIC (CRITICAL - faster A2/A3 cycling), Cycle of Violence, Kill Streak, Methodical"
    ],
    "general": "CORRECTED: Giant Slayer for all PVE content (A1 'Dual Strike' attacks 2 times = multi-hit, 30% proc per hit = ~51% total proc chance). Warmaster INCORRECT for multi-hit champion. Helmsmasher viable for Arena burst damage. Master Hexer CRITICAL (extends Dec DEF/Weaken/HP Burn debuffs). Eagle Eye CRITICAL (+50 ACC for 250+ total, reliable debuff landing). Swarm Smiter CRITICAL (multi-hit A1 synergy). Cycle of Magic CRITICAL (reduces A2/A3 cooldowns for more frequent Provoke/debuff spread/Taunt). Arena can use Helmsmasher for Ignore DEF burst instead of Giant Slayer."
  },
  "blessings": ["Nature's Wrath", "Lightning Cage", "Irethi Coronet", "Stormcaller", "Wand of Submission"],
  "ai_quirks": {
    "bad_ai": false,
    "ai_issue_description": "Generally good AI. Will use debuff spread and taunt appropriately."
  },
  "cheese_strategy": {
    "cheese_viable": false,
    "cheese_type": "N/A",
    "cheese_mechanic_info": "Not a cheese champion."
  },
  "mechanics_advisory": "Best used for debuff spreading and control. Synergizes with other TMNT champions for ally join attacks. Build for high crit rate and accuracy to maximize kit value.",
  "citations": [
    "Ayumilove: https://ayumilove.net/raid-shadow-legends-michelangelo-skill-mastery-equip-guide/ (accessed 2025-10-22)",
    "HellHades: https://hellhades.com/champions/michelangelo/ (accessed 2025-10-22)"
  ],
  "update_notes": {
    "last_updated": "2025-10-22",
    "last_patch": "Patch 10.60.5 (2025-08-21): Champion released."
  }
}
