{
  "name": "Taya",
  "rarity": "Epic",
  "affinity": "Void",
  "faction": "Shadowkin",
  "role": "Attack",
  "draft": true,
  "meta_ratings": {
    "clan_boss": "X/10",
    "dungeons": "X/10",
    "doom_tower": "X/10",
    "arena": "X/10",
    "faction_wars": "X/10"
  },
  "forms": [
    {
      "form_name": "Base",
      "base_stats": {
        "HP": "",
        "ATK": "",
        "DEF": "",
        "SPD": "",
        "C.RATE": "",
        "C.DMG": 60,
        "RES": 30,
        "ACC": ""
      },
      "skills": [
        {
          "name": "Daze Powder",
          "type": "A1",
          "description": "Attacks 1 enemy. Has a 50% chance of placing a 50% [Decrease ACC] debuff for 2 turns.\nLevel 2: Damage +5%\nLevel 3: Damage +5%\nLevel 4: Buff/Debuff Chance +5%\nLevel 5: Buff/Debuff Chance +5%\nDamage Multiplier: 3.65 ATK",
          "effects": [
            {
              "type": "damage|shield|heal|turn_meter_fill|turn_meter_steal|revive|buff|debuff|stat_swap|stat_steal|reflect_damage|other",
              "stat": "ATK|HP|DEF|MAX HP|ENEMY_MAX_HP|Turn Meter|NA|... (as needed, where NA is 'not applicable'. This allows schema validation. This value should not be null)",
              "value": 0.0,
              "per_hit": false,
              "target": "single_enemy|random_enemy|aoe_enemies|single_ally|random_ally|aoe_allies|self",
              "duration": "Duration of buff/debuff in turns (if applicable)",
              "notes": "Describe scaling, conditions, or special logic. Use multiple objects for multi-component or conditional effects."
            }
          ],
          "cooldown_booked": null,
          "mechanics_tags": [
            "Relevant mechanic tags"
          ],
          "book_value": "Value to fully book ex faster cooldown, more damage or debuff chance, etc.",
          "notes": "Additional notes (conditional effects, scaling, special interactions, etc.)"
        },
        {
          "name": "Venom Kunai (Cooldown: 4 turns)",
          "type": "A2",
          "description": "Attacks 1 enemy 3 times. Each hit has a 75% chance of placing a 5% [Poison] debuff for 2 turns\nLevel 2: Damage +5%\nLevel 3: Damage +10%\nLevel 4: Buff/Debuff Chance +10%\nLevel 5: Buff/Debuff Chance +15%\nLevel 6: Cooldown -1\nDamage Multiplier: 1.95 ATK",
          "effects": [
            {
              "type": "damage|shield|heal|turn_meter_fill|turn_meter_steal|revive|buff|debuff|stat_swap|stat_steal|reflect_damage|other",
              "stat": "ATK|HP|DEF|MAX HP|ENEMY_MAX_HP|Turn Meter|NA|... (as needed, where NA is 'not applicable'. This allows schema validation. This value should not be null)",
              "value": 0.0,
              "per_hit": false,
              "target": "single_enemy|random_enemy|aoe_enemies|single_ally|random_ally|aoe_allies|self",
              "duration": "Duration of buff/debuff in turns (if applicable)",
              "notes": "Describe scaling, conditions, or special logic. Use multiple objects for multi-component or conditional effects."
            }
          ],
          "cooldown_booked": null,
          "mechanics_tags": [
            "Relevant mechanic tags"
          ],
          "book_value": "Value to fully book ex faster cooldown, more damage or debuff chance, etc.",
          "notes": "Additional notes (conditional effects, scaling, special interactions, etc.)"
        },
        {
          "name": "Blood Boil (Cooldown: 4 turns)",
          "type": "A3",
          "description": "Attacks 1 enemy. Has a 75% chance of instantly activating any [Poison] debuffs and [HP Burn] debuffs on the target. Also has a 75% chance of placing a 100% [Heal Reduction] debuff for 2 turns.\nLevel 2: Damage +10%\nLevel 3: Damage +10%\nLevel 4: Buff/Debuff Chance +10%\nLevel 5: Buff/Debuff Chance +15%\nLevel 6: Cooldown -1\nDamage Multiplier: 5.5 ATK",
          "effects": [
            {
              "type": "damage|shield|heal|turn_meter_fill|turn_meter_steal|revive|buff|debuff|stat_swap|stat_steal|reflect_damage|other",
              "stat": "ATK|HP|DEF|MAX HP|ENEMY_MAX_HP|Turn Meter|NA|... (as needed, where NA is 'not applicable'. This allows schema validation. This value should not be null)",
              "value": 0.0,
              "per_hit": false,
              "target": "single_enemy|random_enemy|aoe_enemies|single_ally|random_ally|aoe_allies|self",
              "duration": "Duration of buff/debuff in turns (if applicable)",
              "notes": "Describe scaling, conditions, or special logic. Use multiple objects for multi-component or conditional effects."
            }
          ],
          "cooldown_booked": null,
          "mechanics_tags": [
            "Relevant mechanic tags"
          ],
          "book_value": "Value to fully book ex faster cooldown, more damage or debuff chance, etc.",
          "notes": "Additional notes (conditional effects, scaling, special interactions, etc.)"
        },
        {
          "name": "",
          "type": "A4",
          "description": "",
          "effects": [
            {
              "type": "damage|shield|heal|turn_meter_fill|turn_meter_steal|revive|buff|debuff|stat_swap|stat_steal|reflect_damage|other",
              "stat": "ATK|HP|DEF|MAX HP|ENEMY_MAX_HP|Turn Meter|NA|... (as needed, where NA is 'not applicable'. This allows schema validation. This value should not be null)",
              "value": 0.0,
              "per_hit": false,
              "target": "single_enemy|random_enemy|aoe_enemies|single_ally|random_ally|aoe_allies|self",
              "duration": "Duration of buff/debuff in turns (if applicable)",
              "notes": "Describe scaling, conditions, or special logic. Use multiple objects for multi-component or conditional effects."
            }
          ],
          "cooldown_booked": null,
          "mechanics_tags": [
            "Relevant mechanic tags"
          ],
          "book_value": "Value to fully book ex faster cooldown, more damage or debuff chance, etc.",
          "notes": "Additional notes (conditional effects, scaling, special interactions, etc.)"
        }
      ],
      "aura": "Increases Ally ACC in all Battles by 50.",
      "comments": "Form-specific notes, edge cases, or user/community feedback."
    }
  ],
  "mechanics_tags": [
    "Relevant mechanic tags"
  ],
  "stat_priorities": [
    "Stat priorities for main content(s)",
    "e.g. 100% Crit Rate, 250+ ACC"
  ],
  "stat_priority_recommendations": {
    "clan_boss": "e.g. 250+ ACC, 220+ SPD, 100% C.RATE",
    "dungeons": "e.g. 220+ SPD, 200+ ACC, HP%/DEF% for survivability",
    "arena": "e.g. 300+ SPD, 100% C.RATE, C.DMG, RES for tank"
  },
  "recommended_gear": [
    "Recommended sets and stats for main content(s)"
  ],
  "masteries": {
    "clan_boss": [
      "Recommended masteries for Clan Boss"
    ],
    "dungeons": [
      "Recommended masteries for Dungeons"
    ],
    "arena": [
      "Recommended masteries for Arena"
    ],
    "doom_tower": [
      "Recommended masteries for Doom Tower"
    ],
    "faction_wars": [
      "Recommended masteries for Faction Wars"
    ],
    "general": [
      "Offense/Support/Defense as needed"
    ]
  },
  "blessings": [
    "Recommended blessings for priority content(s)"
  ],
  "ai_quirks": {
    "bad_ai": false,
    "ai_issue_description": "Describe problematic skill priority, targeting, or auto-play behavior"
  },
  "cheese_strategy": {
    "cheese_viable": false,
    "cheese_type": "unkillable/max HP/passive sustain/etc.",
    "cheese_mechanic_info": "If true, describe the cheese mechanic and requirements"
  },
  "mechanics_advisory": "Notes on unique mechanics, synergy, or special use cases",
  "validation_metadata": {
    "stat_confidence": 25.0,
    "data_sources": "ayumilove_ocr+hellhades",
    "source_priority": {
      "stats": "ayumilove_ocr",
      "skills": "ayumilove",
      "info": "ayumilove"
    },
    "ocr_notes": "Ayumilove OCR: Primary stats source (2/8 extracted), Ayumilove: Skills source (canonical), HellHades: Info validation"
  },
  "citations": [
    "Ayumilove: https://ayumilove.net/raid-shadow-legends-champion-name/ (accessed YYYY-MM-DD)",
    "HellHades: https://hellhades.com/champions/champion-name/ (accessed YYYY-MM-DD)"
  ],
  "author": "Author Name (e.g., GitHub Copilot)",
  "comments": "Top-level comments about the entry. For form-specific notes use forms[*].comments.",
  "update_notes": {
    "last_updated": "YYYY-MM-DD",
    "last_patch": "Patch version/date and summary of change"
  }
}