{
  "name": "Brakus the Shifter",
  "rarity": "Legendary",
  "affinity": "Force",
  "faction": "",
  "role": "Attack",
  "draft": true,
  "forms": [
    {
      "form_name": "Base",
      "base_stats": {
        "HP": 19815,
        "ATK": 1465,
        "DEF": 793,
        "SPD": 101,
        "C.RATE": 15,
        "C.DMG": 63,
        "RES": 40,
        "ACC": 0
      },
      "skills": [
        {
          "name": "Innocent Blood",
          "description": "Attacks 1 enemy. Heals this Champion by 15% of the damage inflicted.\nDamage based on\n[ATK]\nLevel 2: Damage +5%\nLevel 3: Damage +5%\nLevel 4: Damage +5%\nLevel 5: Damage +5%",
          "type": "Active",
          "effects": [],
          "cooldown_booked": null
        },
        {
          "name": "Full Moon Rampage",
          "description": "Attacks 1 enemy 6 times. Heals this Champion by 25% of the damage inflicted. Heals this Champion by 50% of the damage inflicted instead if the target is under a\n[Fear]\nor a\n[True Fear]\ndebuff. After the first hit, has a 75% chance of placing a 25%\n[Weaken]\ndebuff for 2 turns.\nDamage based on\n[ATK]\nLevel 2: Damage +10%\nLevel 3: Damage +15%\nLevel 4: Buff/Debuff Chance +10%\nLevel 5: Buff/Debuff Chance +15%\nLevel 6: Cooldown -1\nLevel 7: Cooldown -1",
          "type": "Active",
          "effects": [],
          "cooldown_booked": null
        },
        {
          "name": "Hunter’s Howl",
          "description": "Places a 50%\n[Increase ATK]\nbuff on all allies for 3 turns, then attacks 1 enemy 3 times. Each hit has a 50% chance of placing a\n[True Fear]\ndebuff for 1 turn. Hasa 50% chance of placing a\n[Fear]\ndebuff on 2 random enemies for 1 turn if the\n[True Fear]\ndebuff is placed.\nDamage based on\n[ATK]\nLevel 2: Damage +10%\nLevel 3: Buff/Debuff Chance +10%\nLevel 4: Buff/Debuff Chance +15%\nLevel 5: Cooldown -1",
          "type": "Active",
          "effects": [],
          "cooldown_booked": null
        },
        {
          "name": "Beast Mode",
          "description": "Passive Effect: Damage increases by 40% when this Champion’s HP drops below 40%. Active Effect: Revives this Champion with 20% HP when killed. Immediately grants an Extra Turn.\nLevel 2: Cooldown -1\nLevel 3: Cooldown -1",
          "type": "Active",
          "effects": [],
          "cooldown_booked": null
        }
      ],
      "aura": null,
      "comments": "Imported from RaidWiki."
    }
  ]
}