{
  "name": "Rathalos Blademaster",
  "rarity": "Legendary",
  "affinity": "Force",
  "faction": "Banner Lords",
  "role": "Attack",
  "draft": true,
  "meta_ratings": {
    "clan_boss": "X/10",
    "dungeons": "X/10",
    "doom_tower": "X/10",
    "arena": "X/10",
    "faction_wars": "X/10"
  },
  "forms": [
    {
      "form_name": "Base",
      "base_stats": {
        "HP": 16185,
        "ATK": 1487,
        "DEF": 1013,
        "SPD": 105,
        "C.RATE": 15,
        "C.DMG": 63,
        "RES": 15,
        "ACC": ""
      },
      "skills": [
        {
          "name": "Spirit Thrust",
          "type": "A1",
          "description": "Attacks 1 enemy. Has a 50% chance of placing a 60% [Decrease DEF] debuff for 2 turns. If the target is a Boss, this debuff cannot be resisted.\nLevel 2: Damage +10%\nLevel 3: Buff/Debuff chance +5%\nLevel 4: Damage +10%\nLevel 5: Buff/Debuff chance +10%\nDamage Multiplier: 3.2 ATK",
          "effects": [
            {
              "type": "damage|shield|heal|turn_meter_fill|turn_meter_steal|revive|buff|debuff|stat_swap|stat_steal|reflect_damage|other",
              "stat": "ATK|HP|DEF|MAX HP|ENEMY_MAX_HP|Turn Meter|NA|... (as needed, where NA is 'not applicable'. This allows schema validation. This value should not be null)",
              "value": 0.0,
              "per_hit": false,
              "target": "single_enemy|random_enemy|aoe_enemies|single_ally|random_ally|aoe_allies|self",
              "duration": "Duration of buff/debuff in turns (if applicable)",
              "notes": "Describe scaling, conditions, or special logic. Use multiple objects for multi-component or conditional effects."
            }
          ],
          "cooldown_booked": null,
          "mechanics_tags": [
            "Relevant mechanic tags"
          ],
          "book_value": "Value to fully book ex faster cooldown, more damage or debuff chance, etc.",
          "notes": "Additional notes (conditional effects, scaling, special interactions, etc.)"
        },
        {
          "name": "Spirit Step Slash (Cooldown: 4 turns)",
          "type": "A2",
          "description": "Attacks 1 enemy. Every second use of this skill in a Round will attack all enemies instead. Will also ignore 25% of the target’s DEF. If the target is a boss, will ignore 100% of the target’s DEF.\nLevel 2: Damage +5%\nLevel 3: Damage +5%\nLevel 4: Damage +10%\nLevel 5: Cooldown -1\nDamage Multiplier: 4 ATK",
          "effects": [
            {
              "type": "damage|shield|heal|turn_meter_fill|turn_meter_steal|revive|buff|debuff|stat_swap|stat_steal|reflect_damage|other",
              "stat": "ATK|HP|DEF|MAX HP|ENEMY_MAX_HP|Turn Meter|NA|... (as needed, where NA is 'not applicable'. This allows schema validation. This value should not be null)",
              "value": 0.0,
              "per_hit": false,
              "target": "single_enemy|random_enemy|aoe_enemies|single_ally|random_ally|aoe_allies|self",
              "duration": "Duration of buff/debuff in turns (if applicable)",
              "notes": "Describe scaling, conditions, or special logic. Use multiple objects for multi-component or conditional effects."
            }
          ],
          "cooldown_booked": null,
          "mechanics_tags": [
            "Relevant mechanic tags"
          ],
          "book_value": "Value to fully book ex faster cooldown, more damage or debuff chance, etc.",
          "notes": "Additional notes (conditional effects, scaling, special interactions, etc.)"
        },
        {
          "name": "Overhead Slash (Cooldown: 4 turns)",
          "type": "A3",
          "description": "Attacks all enemies. Before attacking, places a 30% [Increase C.DMG] buff and a 30% [Increase SPD] buff on this Champion for 2 turns.\nLevel 2: Damage +5%\nLevel 3: Damage +5%\nLevel 4: Damage +10%\nLevel 5: Cooldown -1\nDamage Multiplier: 4.1 ATK",
          "effects": [
            {
              "type": "damage|shield|heal|turn_meter_fill|turn_meter_steal|revive|buff|debuff|stat_swap|stat_steal|reflect_damage|other",
              "stat": "ATK|HP|DEF|MAX HP|ENEMY_MAX_HP|Turn Meter|NA|... (as needed, where NA is 'not applicable'. This allows schema validation. This value should not be null)",
              "value": 0.0,
              "per_hit": false,
              "target": "single_enemy|random_enemy|aoe_enemies|single_ally|random_ally|aoe_allies|self",
              "duration": "Duration of buff/debuff in turns (if applicable)",
              "notes": "Describe scaling, conditions, or special logic. Use multiple objects for multi-component or conditional effects."
            }
          ],
          "cooldown_booked": null,
          "mechanics_tags": [
            "Relevant mechanic tags"
          ],
          "book_value": "Value to fully book ex faster cooldown, more damage or debuff chance, etc.",
          "notes": "Additional notes (conditional effects, scaling, special interactions, etc.)"
        },
        {
          "name": "Rathalos Mastery (Passive)",
          "type": "Passive",
          "description": "Inflicts 50% more damage against targets under [HP Burn] debuffs.\nReceives 25% less damage from enemies under [HP Burn] debuffs.\nEvery fifth skill used by this Champion deals 200% more damage.\nNote: To enable Rathalos Blademaster to quickly reach his 5th skill usage, pair him with champions who can provide him\nCounter Attack\nbuff and\nAlly Joint Attacks\n. You can also equip him in Retaliation Set or have Retribution mastery to allow him to counter-attack enemies whenever he gets attacked! Relentless Set is a better alternative artifact that you can use to cycle his skills even faster compared to Retalation Set.",
          "effects": [
            {
              "type": "damage|shield|heal|turn_meter_fill|turn_meter_steal|revive|buff|debuff|stat_swap|stat_steal|reflect_damage|other",
              "stat": "ATK|HP|DEF|MAX HP|ENEMY_MAX_HP|Turn Meter|NA|... (as needed, where NA is 'not applicable'. This allows schema validation. This value should not be null)",
              "value": 0.0,
              "per_hit": false,
              "target": "single_enemy|random_enemy|aoe_enemies|single_ally|random_ally|aoe_allies|self",
              "duration": "Duration of buff/debuff in turns (if applicable)",
              "notes": "Describe scaling, conditions, or special logic. Use multiple objects for multi-component or conditional effects."
            }
          ],
          "cooldown_booked": null,
          "mechanics_tags": [
            "Relevant mechanic tags"
          ],
          "book_value": "Value to fully book ex faster cooldown, more damage or debuff chance, etc.",
          "notes": "Additional notes (conditional effects, scaling, special interactions, etc.)"
        }
      ],
      "aura": "Increases Ally ATK in Dungeons by 30%",
      "comments": "Form-specific notes, edge cases, or user/community feedback."
    }
  ],
  "mechanics_tags": [
    "Relevant mechanic tags"
  ],
  "stat_priorities": [
    "Stat priorities for main content(s)",
    "e.g. 100% Crit Rate, 250+ ACC"
  ],
  "stat_priority_recommendations": {
    "clan_boss": "e.g. 250+ ACC, 220+ SPD, 100% C.RATE",
    "dungeons": "e.g. 220+ SPD, 200+ ACC, HP%/DEF% for survivability",
    "arena": "e.g. 300+ SPD, 100% C.RATE, C.DMG, RES for tank"
  },
  "recommended_gear": [
    "Recommended sets and stats for main content(s)"
  ],
  "masteries": {
    "clan_boss": [
      "Recommended masteries for Clan Boss"
    ],
    "dungeons": [
      "Recommended masteries for Dungeons"
    ],
    "arena": [
      "Recommended masteries for Arena"
    ],
    "doom_tower": [
      "Recommended masteries for Doom Tower"
    ],
    "faction_wars": [
      "Recommended masteries for Faction Wars"
    ],
    "general": [
      "Offense/Support/Defense as needed"
    ]
  },
  "blessings": [
    "Recommended blessings for priority content(s)"
  ],
  "ai_quirks": {
    "bad_ai": false,
    "ai_issue_description": "Describe problematic skill priority, targeting, or auto-play behavior"
  },
  "cheese_strategy": {
    "cheese_viable": false,
    "cheese_type": "unkillable/max HP/passive sustain/etc.",
    "cheese_mechanic_info": "If true, describe the cheese mechanic and requirements"
  },
  "mechanics_advisory": "Notes on unique mechanics, synergy, or special use cases",
  "validation_metadata": {
    "stat_confidence": 87.5,
    "data_sources": "ayumilove_ocr+hellhades",
    "source_priority": {
      "stats": "ayumilove_ocr",
      "skills": "ayumilove",
      "info": "ayumilove"
    },
    "ocr_notes": "Ayumilove OCR: Primary stats source (7/8 extracted), Ayumilove: Skills source (canonical), HellHades: Info validation"
  },
  "citations": [
    "Ayumilove: https://ayumilove.net/raid-shadow-legends-champion-name/ (accessed YYYY-MM-DD)",
    "HellHades: https://hellhades.com/champions/champion-name/ (accessed YYYY-MM-DD)"
  ],
  "author": "Author Name (e.g., GitHub Copilot)",
  "comments": "Top-level comments about the entry. For form-specific notes use forms[*].comments.",
  "update_notes": {
    "last_updated": "YYYY-MM-DD",
    "last_patch": "Patch version/date and summary of change"
  }
}